Facolta;ID;Nome;Classe;Laurea;Descrizione
Medicina e Chirurgia;MT14;Scienze delle Professioni Sanitarie Tecniche Assistenziali;LM-STN3;Magistrale;Lo sviluppo del percorso formativo del Corso di Laurea Magistrale tiene conto del fatto che i laureati della classe della laurea magistrale nelle scienze delle professioni sanitarie tecniche assistenziali, ai sensi dell'articolo 6, comma 3 del decreto legislativo 30 dicembre 1992, n. 502, e successive modificazioni e integrazioni e ai sensi della legge 10 agosto 2000, n. 251, articolo 1, comma 1, devono conseguire una formazione culturale e professionale avanzata per intervenire con elevate competenze nei processi assistenziali, gestionali, formativi e di ricerca in uno degli ambiti pertinenti alle diverse professioni sanitarie ricomprese nella classe (area tecnico-assistenziale: tecnico ortopedico, tecnico audioprotesista,tecnico della fisiopatologia cardiocircolatoria e perfusione cardiovascolare, igienista dentale).
Medicina e Chirurgia;MT15;Scienze delle Professioni Sanitarie Teniche Diagnostiche;LM-STN3;Magistrale;Lo sviluppo del percorso formativo del Corso di Laurea Magistrale tiene conto del fatto che i laureati della classe della laurea magistrale nelle scienze delle professioni sanitarie tecniche diagnostiche, ai sensi dell'articolo 6, comma 3 del decreto legislativo 30 dicembre 1992, n. 502, e successive modificazioni e integrazioni e ai sensi della legge 10 agosto 2000, n. 251, articolo 1, comma 1, devono conseguire una formazione culturale e professionale avanzata per intervenire con elevate competenze nei processi assistenziali, gestionali, formativi e di ricerca in uno degli ambiti pertinenti alle diverse professioni sanitarie ricomprese nella classe (area tecnico-diagnostica: tecnico audiometrista, tecnico sanitario di laboratorio biomedico, tecnico sanitario di radiologia biomedica, tecnico di neurofiopatologia).
Medicina e Chirurgia;MT16;Scienze Riabilititative delle Professioni Sanitarie;LM-STN2;Magistrale;ll Corso di Laurea Magistrale in Scienze Riabilitative delle Professioni Sanitarie (CLM) ha l'obiettivo di fornire una formazione culturale e professionale avanzata per intervenire con elevate competenze nei processi assistenziali, gestionali, formativi e di ricerca negli ambiti pertinenti alle diverse professioni sanitarie ricomprese nella Classe (Podologo, Fisioterapista, Logopedista, Ortottista-assistente di oftalmologia, Tecnico della Riabilitazione Psichiatrica, Terapista Occupazionale, Educatore Professionale, Terapista della neuro-psicomotricità età evolutiva).
Scienze;ST01;Scienze Biologiche;L-13;Triennale;Il Corso si propone di formare laureati dotati di solide conoscenze di base nei diversi settori della Biologia affiancate da conoscenze caratterizzanti negli ambiti specifici definiti dai due curricula. Il Corso fornisce, inoltre, adeguate competenze nelle metodologie e tecnologie di indagine sperimentale più avanzate indispensabili per la comprensione e l’analisi dei fenomeni biologici.
Scienze;ST02;Scienze Ambientali e Protezione Civile;L-32;Triennale;Il Corso di laurea integra conoscenze delle scienze di base con competenze approfondite inerenti ambiente ed ecosistemi, cambiamenti globali, pericolo idrogeologico, sismico e vulcanico, inquinamento e degrado ambientale, tecniche di monitoraggio, sistemi di recupero ambientale, e su questa base scientifica si inserisce una formazione specialistica di protezione civile in termini di previsione, prevenzione e gestione delle emergenze, che rende questo corso unico nel panorama italiano
Scienze;SM01;Biologia Molecolare e Applicata;LM-6;Magistrale;La laurea di Biologia Molecolare e Applicata è articolata in due curricula: 'Tecnologie Biologiche' e 'Scienze della Nutrizione'. Il Corso di laurea comprende quattro aree tematiche: area cellulare e molecolare (comune ai due indirizzi) e due aree specifiche relative alle tecnologie biologiche e alle scienze della nutrizione. Questo corso di laurea forma esperti di alto livello nell’ambito della biologia molecolare, genetica, biochimica, microbiologia, biotecnologie cellulari, biotecnologie della riproduzione, scienze della nutrizione e più in generale nelle tecnologie per la salute e la qualità della vita.
Scienze;SM02;Biologia Marina;LM-6;Magistrale;La necessità di un corso di Laurea Magistrale in Biologia Marina risiede nella sempre maggiore consapevolezza che il rapido degrado dell'ambiente sia dovuto alle attività dell'uomo, in grado di compromettere il capitale naturale e con esso anche il nostro benessere. Per invertire il trend attuale e andare verso una transizione ecologica sono necessarie strategie basate sulle migliori conoscenze scientifiche e tecnologie in grado di coniugare le necessità dell’uomo con la conservazione e l’uso sostenibile delle risorse naturali.
Scienze;SM03;Rischio Ambientale e Protezione Civile;LM-75;Magistrale;Il corso di laurea magistrale in Rischio Ambientale e Protezione Civile (classe LM-75) ha l'obiettivo di formare laureati magistrali capaci di analizzare, interpretare e gestire il complesso rapporto uomo-ambiente, nell'ambito delle problematiche di sostenibilità delle risorse naturali e di pianificazione, coordinamento e gestione delle attività di protezione civile.
